<?xml version="1.0"?> 
<institut>xmlns:xsi="http://www.w3.org/2001/XMLSchema-instance" xsi:noNamespaceSchemaLocation="exercici10.xsd"
   <alumne data_naixement="1-1-2005"> 
      <dades> 
         <nom>Harry</nom> 
         <llinatges>Potter</llinatges> 
         <dni>411113333</dni> 
      </dades>
      <comentaris>Un poc dispers</comentaris> 
   </alumne> 
   <alumne data_naixement="2-2-1999"> 
      <dades> 
         <nom>Bart</nom> 
         <llinatges>Simpson</llinatges> 
         <dni>566565656</dni> 
      </dades>
      <comentaris>caòtic</comentaris> 
   </alumne> 
   <alumne data_naixement="3-3-1975"> 
      <dades> 
         <nom>Darth</nom> 
         <llinatges>Vader</llinatges> 
         <dni>100000012</dni> 
       </dades>
       <comentaris>Misteriós</comentaris> 
   </alumne> 
</institut>